<?xml version="1.0"?>
<info xmlns:xsi="http://www.w3.org/2001/XMLSchema-instance" xsi:noNamespaceSchemaLocation="../../../release/info.xsd">
    <id>skynettechnologiesallinoneaccessibility</id>
    <name>News</name>
    <summary>An RSS/Atom feed reader</summary>
    <description>An RSS/Atom feed reader</description>
    <version>8.8.2</version>
    <licence>AGPL-3.0-or-later</licence>
    <author>Bernhard Posselt</author>
    <category>multimedia</category>
    <bugs>https://github.com/nextcloud/news/issues</bugs>
    <dependencies>
        <nextcloud min-version="31" max-version="32"/>
    </dependencies>
</info>
