<?xml version="1.0"?>
<info xmlns:xsi="http://www.w3.org/2001/XMLSchema-instance" xsi:noNamespaceSchemaLocation="../../../appmetadata/info.xsd">
    <id>news</id>
    <name lang="de">News</name>
    <summary>An RSS/Atom feed reader</summary>
    <description>An RSS/Atom feed reader</description>
    <version>8.8.2</version>
    <licence>agpl</licence>
    <author>Bernhard Posselt</author>
    <category>multimedia</category>
    <dependencies>
        <owncloud min-version="9.0"/>
    </dependencies>
</info>
