<?xml version="1.0"?>
<info xmlns:xsi="http://www.w3.org/2001/XMLSchema-instance" xsi:noNamespaceSchemaLocation="../../../release/info.xsd">
    <id>news</id>
    <name>News</name>
    <summary>An RSS/Atom feed reader</summary>
    <description>An RSS/Atom feed reader</description>
    <version>8.8.2</version>
    <licence>agpl</licence>
    <author>Bernhard Posselt</author>
    <documentation>
        <user>ttps://github.com/owncloud/news/wiki#user-documentation</user>
        <admin>ttps://github.com/owncloud/news#readme</admin>
        <developer>ttps://github.com/owncloud/news/wiki#developer-documentation</developer>
    </documentation>
    <category>multimedia</category>
    <bugs>https://github.com/nextcloud/news/issues</bugs>
    <dependencies>
        <nextcloud min-version="11" max-version="12"/>
    </dependencies>
</info>
