<?xml version="1.0"?>
<info xmlns:xsi= "http://www.w3.org/2001/XMLSchema-instance"
      xsi:noNamespaceSchemaLocation="https://apps.nextcloud.com/schema/apps/info.xsd">
    <id>theapp</id>
    <name>The App</name>
    <summary>a summary</summary>
    <description><![CDATA[a description]]></description>
    <licence>agpl</licence>
    <author mail="author email" homepage="author homepage">author name</author>
    <version>0.0.1</version>
    <namespace>TheApp</namespace>
    <category>tools</category>
    <bugs>https://test.com</bugs>
    <dependencies>
        <owncloud min-version="9.2"/>
        <nextcloud min-version="11" max-version="11"/>
    </dependencies>
</info>
