<?xml version="1.0"?>
<info xmlns:xsi= "http://www.w3.org/2001/XMLSchema-instance"
      xsi:noNamespaceSchemaLocation="https://apps.nextcloud.com/schema/apps/info.xsd">
    <!--
    SPDX-FileCopyrightText: {{ app.author_name }} <{{ app.author_mail }}>
    SPDX-License-Identifier: CC0-1.0
    -->
    <id>{{ app.id }}</id>
    <name>{{ app.name }}</name>
    <summary>{{ app.summary }}</summary>
    <description><![CDATA[{{ app.description }}]]></description>
    <version>0.0.1</version>
    <licence>agpl</licence>
    <author {% if app.author_mail %}mail="{{ app.author_mail }}"{% endif %} {% if app.author_homepage %}homepage="{{ app.author_homepage }}"{% endif %}>{{ app.author_name }}</author>
    <namespace>{{ app.namespace }}</namespace>{% for category in app.categories %}
    <category>{{ category }}</category>{% endfor %}
    <bugs>{{ app.issue_tracker }}</bugs>
    <dependencies>
        <nextcloud min-version="{{ app.nextcloud_version }}" max-version="{{ app.nextcloud_version }}"/>
    </dependencies>
    <navigations>
        <navigation>
            <name>{{ app.name }}</name>
            <route>{{ app.id }}.page.index</route>
        </navigation>
    </navigations>
</info>
