<?xml version="1.0"?>
<info xmlns:xsi= "http://www.w3.org/2001/XMLSchema-instance"
      xsi:noNamespaceSchemaLocation="https://apps.nextcloud.com/schema/apps/info.xsd">
    <id>{{ app.id }}</id>
    <name>{{ app.name }}</name>
    <summary>{{ app.summary }}</summary>
    <description><![CDATA[{{ app.description }}]]></description>
    <licence>agpl</licence>
    <author {% if app.author_mail %}mail="{{ app.author_mail }}"{% endif %} {% if app.author_homepage %}homepage="{{ app.author_homepage }}"{% endif %}>{{ app.author_name }}</author>
    <version>0.0.1</version>
    <namespace>{{ app.namespace }}</namespace>{% for category in app.categories %}
    <category>{{ category }}</category>{% endfor %}
    <dependencies>
        <owncloud min-version="{{ app.nextcloud_version }}"/>
        <nextcloud min-version="{{ app.owncloud_version }}"/>
    </dependencies>
</info>
