<?xml version="1.0"?>
<info xmlns:xsi="http://www.w3.org/2001/XMLSchema-instance"
	  xsi:noNamespaceSchemaLocation="https://apps.nextcloud.com/schema/apps/info.xsd">
	<id>theapp</id>
	<name>The App</name>
	<summary>a summary</summary>
	<description>a description</description>
	<version>1.0.0</version>
	<licence>AGPL-3.0-or-later</licence>
	<author mail="author email" homepage="author homepage">author name</author>
	<namespace>TheApp</namespace>
	<category>tools</category>
	<bugs>https://test.com</bugs>
	<dependencies>
		<nextcloud min-version="31" max-version="33"/>
	</dependencies>
	<navigations>
		<navigation>
			<id>theapp</id>
			<name>The App</name>
			<route>theapp.page.index</route>
			<icon>app.svg</icon>
			<type>link</type>
		</navigation>
	</navigations>
</info>
