<?xml version="1.0"?>
<!--
  - SPDX-FileCopyrightText: 2026 Nextcloud GmbH and Nextcloud contributors
  - SPDX-License-Identifier: AGPL-3.0-or-later
-->
<info xmlns:xsi="http://www.w3.org/2001/XMLSchema-instance" xsi:noNamespaceSchemaLocation="../../../release/info.xsd">
    <id>news</id>
    <name>News</name>
    <summary>An RSS/Atom feed reader</summary>
    <description>An RSS/Atom feed reader</description>
    <version>8.8.2</version>
    <licence>AGPL-3.0-or-later</licence>
    <author>Bernhard Posselt</author>
    <category>multimedia</category>
    <bugs>https://github.com/nextcloud/news/issues</bugs>
    <video>https://peertube.tv/w/dMWVlMwd9ecp5UVAOUhTDt</video>
    <video>https://peertube.tv/videos/embed/TpUpEIu3PkYqljmQw7T0jR</video>
    <screenshot>https://example.com/1.png</screenshot>
    <dependencies>
        <nextcloud min-version="31" max-version="32"/>
    </dependencies>
</info>
